"DESCRIPTION","DURATION IN MS","NAME","PARENT SUITE","START TIME","STATUS","STOP TIME","SUB SUITE","SUITE","TEST CLASS","TEST METHOD"
"","17391","Add a product to the shopping cart","","Fri Jan 03 17:21:01 UTC 2025","passed","Fri Jan 03 17:21:19 UTC 2025","","","",""
"","7793","Successfully update account details","","Fri Jan 03 17:21:20 UTC 2025","passed","Fri Jan 03 17:21:28 UTC 2025","","","",""
"","14182","Add a product to the wishlist from the products page","","Fri Jan 03 17:20:43 UTC 2025","passed","Fri Jan 03 17:20:57 UTC 2025","","","",""
"","4451","Remove a product from the wishlist","","Fri Jan 03 17:20:57 UTC 2025","passed","Fri Jan 03 17:21:01 UTC 2025","","","",""
"","7790","Validation errors when fields are left empty or invalid","","Fri Jan 03 17:21:28 UTC 2025","passed","Fri Jan 03 17:21:36 UTC 2025","","","",""
"","44321","User registration with existing email address","","Fri Jan 03 17:19:58 UTC 2025","passed","Fri Jan 03 17:20:43 UTC 2025","","","",""
"","1337","Remove a product from the shopping cart","","Fri Jan 03 17:21:19 UTC 2025","broken","Fri Jan 03 17:21:20 UTC 2025","","","",""
"","18243","Add a new address with valid details","","Fri Jan 03 17:21:36 UTC 2025","passed","Fri Jan 03 17:21:54 UTC 2025","","","",""
"","32602","User registration with valid data","","Fri Jan 03 17:19:26 UTC 2025","passed","Fri Jan 03 17:19:58 UTC 2025","","","",""
