"DESCRIPTION","DURATION IN MS","NAME","PARENT SUITE","START TIME","STATUS","STOP TIME","SUB SUITE","SUITE","TEST CLASS","TEST METHOD"
"","4407","Remove a product from the wishlist","","Sat Jan 04 18:01:55 UTC 2025","passed","Sat Jan 04 18:01:59 UTC 2025","","","",""
"","18231","Add a new address with valid details","","Sat Jan 04 18:02:34 UTC 2025","passed","Sat Jan 04 18:02:52 UTC 2025","","","",""
"","7785","Successfully update account details","","Sat Jan 04 18:02:18 UTC 2025","passed","Sat Jan 04 18:02:26 UTC 2025","","","",""
"","17360","Add a product to the shopping cart","","Sat Jan 04 18:01:59 UTC 2025","passed","Sat Jan 04 18:02:17 UTC 2025","","","",""
"","22900","User registration with valid data","","Sat Jan 04 18:00:27 UTC 2025","passed","Sat Jan 04 18:00:50 UTC 2025","","","",""
"","7804","Validation errors when fields are left empty or invalid","","Sat Jan 04 18:02:26 UTC 2025","passed","Sat Jan 04 18:02:34 UTC 2025","","","",""
"","50772","User registration with existing email address","","Sat Jan 04 18:00:50 UTC 2025","passed","Sat Jan 04 18:01:41 UTC 2025","","","",""
"","14257","Add a product to the wishlist from the products page","","Sat Jan 04 18:01:41 UTC 2025","passed","Sat Jan 04 18:01:55 UTC 2025","","","",""
"","1341","Remove a product from the shopping cart","","Sat Jan 04 18:02:17 UTC 2025","broken","Sat Jan 04 18:02:18 UTC 2025","","","",""
