"DESCRIPTION","DURATION IN MS","NAME","PARENT SUITE","START TIME","STATUS","STOP TIME","SUB SUITE","SUITE","TEST CLASS","TEST METHOD"
"","30","Remove a product from the shopping cart","","Fri Jan 03 15:47:50 UTC 2025","passed","Fri Jan 03 15:47:50 UTC 2025","","","",""
"","14272","Add a product to the wishlist from the products page","","Fri Jan 03 15:47:31 UTC 2025","passed","Fri Jan 03 15:47:45 UTC 2025","","","",""
"","30","Add a product to the shopping cart","","Fri Jan 03 15:47:50 UTC 2025","passed","Fri Jan 03 15:47:50 UTC 2025","","","",""
"","50807","User registration with existing email address","","Fri Jan 03 15:46:40 UTC 2025","passed","Fri Jan 03 15:47:31 UTC 2025","","","",""
"","4415","Remove a product from the wishlist","","Fri Jan 03 15:47:45 UTC 2025","passed","Fri Jan 03 15:47:50 UTC 2025","","","",""
"","7805","Validation errors when fields are left empty or invalid","","Fri Jan 03 15:48:00 UTC 2025","passed","Fri Jan 03 15:48:07 UTC 2025","","","",""
"","18228","Add a new address with valid details","","Fri Jan 03 15:48:07 UTC 2025","passed","Fri Jan 03 15:48:26 UTC 2025","","","",""
"","22850","User registration with valid data","","Fri Jan 03 15:46:17 UTC 2025","passed","Fri Jan 03 15:46:40 UTC 2025","","","",""
"","9789","Successfully update account details","","Fri Jan 03 15:47:50 UTC 2025","passed","Fri Jan 03 15:48:00 UTC 2025","","","",""
